token	label	LeNC44.L1LLRx5.x	LeNC44.L1LLRx5.y	LeNC77.L1LLR.x	LeNC77.L1LLR.y	LeNC44.L1LLR.x	LeNC44.L1LLR.y	LeNC77.L1LLRx5.x	LeNC77.L1LLRx5.y	LeNC44.ppmi.x	LeNC44.ppmi.y	LeNC77.ppmi.x	LeNC77.ppmi.y	text
therapeut/noun/DT_20040403_01/11162	b	-6.67816449328	3.923353007	4.602797579	1.42050029178	-5.9457590078	-3.37624464124	-0.846336168689	6.38748788866	-1.45674907448	-7.23346823776	-1.96738283819	-4.01099268291	"Volgens de <font color=""red"">therapeut</font> Bob Vansant stellen we veel te veel vertrouwen in therapeuten en psychiaters ."
therapeut/noun/DT_20040816_01/29434	b	-0.800226601121	1.21235045733	0.764335700893	1.73323940399	-0.821746685525	-0.55914723877	-1.43441539287	-0.197439017868	0.900532746092	0.581799212221	0.242040024806	0.784975244564	"Van alle <font color=""red"">therapeuten</font> die dagelijks het Amerikaanse beeldscherm vullen , is hij de populairste met zijn Dr. Phil Show ."
therapeut/noun/DT_20040920_01/10890	b	0.866356091044	0.837554771687	0.818451538029	0.599931356686	1.16328570471	0.344341999026	-0.32727748044	-0.59678798652	0.454249200194	0.812129510241	-0.202441934866	0.877015324274	"Als we Willy DeVille erop wijzen dat zijn gelaat blijkbaar gespaard is gebleven van al te diepe levensgroeven , antwoordt hij met een glimlach dat zijn <font color=""red"">therapeut</font> hem steevast omschrijft als een ' volwassen kind ' ."
therapeut/noun/DT_20050219_01/16880	b	-0.150268169756	-4.55576678011	-1.24123761906	1.96148146797	0.669964511431	5.07827593885	-0.0157900720474	-3.85089197386	0.0395758003214	5.90437807053	-2.22372946006	-0.667417447226	"Aanvankelijk ging het nog om gesprekken tussen alleen maar <font color=""red"">therapeut</font> en cliënt ."
therapeut/noun/LN_20001128_01/72251	b	1.90695393817	-2.61986101169	-0.798398447165	-2.55667718995	1.42830497548	2.86424633594	5.60660760311	-3.0987269566	9.37953169999	1.24278254206	6.49912445992	-2.27951376943	"Het hof van beroep in Antwerpen heeft vrijdag een 55-jarige <font color=""red"">therapeut</font> uit Deurne vrijgesproken voor verkrachting en aanranding van de eerbaarheid van twee vrouwelijke cliënten ."
therapeut/noun/DS_20051001_01/68958	b	0.489329762298	-1.52304661175	-0.861755158729	-1.07678957086	-1.5692179491	1.29204953729	2.99822275269	2.22701731927	-2.78142938419	-5.01212237123	-0.324364448119	-4.48658139826	"Is het pestgedrag op het werk toch geëscaleerd , dan kan de preventieadviseur de werknemer doorverwijzen naar een <font color=""red"">therapeut</font> of psycholoog ."
therapeut/noun/LN_20010217_01/28257	b	3.72320365876	-0.84201796552	1.64331612585	-1.6643164194	3.81531013002	1.52170477939	2.81483723081	-1.42407817186	1.27843283798	4.23928010114	0.199058799739	3.36906404378	"Op Valentijn werd in Canada zelfs een <font color=""red"">therapeut</font> geplaatst in elke Ikea om de geliefden op de dag van de romantiek toch niet op de vuist te laten gaan ."
therapeut/noun/LN_20010509_01/165220	b	2.03419499367	-1.77070153204	0.634067396928	-1.2545285958	2.3944226489	2.78853219619	2.05573123107	-1.13179305351	4.3928888812	1.43890474673	3.20626968075	0.475918251863	"Om de brokken te lijmen schakelt de lokale voorzitter Peter Paulussen een professionele <font color=""red"">therapeut</font> in om zijn troepen wat groepsgeest bij te brengen ."
therapeut/noun/LN_20011003_01/177166	b	0.618141959803	4.87605984565	2.79554435044	2.26828312954	1.45596584591	-3.70853942764	-3.6005697898	1.07703391998	-1.39768029891	2.65355834308	0.454186846003	2.45510072675	" <font color=""red"">Therapeuten</font> weten dat de tijd ook z'n werk moet doen ."
therapeut/noun/LN_20011115_01/113639	b	1.26781023488	2.47029659117	1.62494787877	0.944516317238	1.68430519535	-0.84837424323	-1.40246554512	0.977545411213	-0.202874116882	1.27001972679	0.574574666464	1.58946349825	"Ik heb ook een aantal <font color=""red"">therapeuten</font> geraadpleegd ."
therapeut/noun/LN_20020221_01/94933	b	12.2019095868	6.18972467094	-0.3937790747	8.8548787202	6.51048451542	-11.0205738364	-10.0599537537	-6.82691831424	13.303207174	1.35502581662	5.18101885227	7.43255678176	" <font color=""red"">Therapeut</font> Jef Bogaerts : "" De meeste jonge daders reageren ontkennend en zien de draagwijdte van hun gedrag niet in : ' Allez , wat heb ik nu misdaan ?"
therapeut/noun/LN_20020904_01/114223	b	-5.99429111683	1.00435633252	-2.09153316593	4.17499157238	-5.04704020742	2.55431096078	-0.308321865094	7.40703868845	-1.17617026099	-9.82590707296	-2.99368824508	-7.39947604184	" <font color=""red"">Therapeut</font> Yves Abicht"
therapeut/noun/LN_20031117_01/136388	b	0.900519669599	-1.84138410116	-0.112239029306	-0.149936281992	0.86726494119	2.52996267416	2.05716284441	-0.456589220102	2.71210940295	-3.06612685143	-3.04676540802	-0.138618602693	"Bij een zelfstandige <font color=""red"">therapeut</font> moeten ze per zitting 30 euro en meer uit eigen zak betalen ."
therapeut/noun/LN_20041120_01/102729	b	1.22571263632	0.730903234331	1.11893321232	0.102222119988	1.54736446418	0.804945934285	0.126966007616	0.124354348384	0.10797976343	0.918574230622	0.445255357474	1.09131646097	"Je bent met de hulp van een <font color=""red"">therapeut</font> afgedaald in je vorige levens ."
therapeut/noun/LN_20050423_01/171573	b	0.494810734148	2.8082609318	1.94909698976	1.52819558058	0.946876970096	-2.07511460993	-2.26229839657	0.201761202444	-0.897270379763	2.05314265324	0.234242786678	2.17336999474	"ongeruste <font color=""red"">therapeut</font> verwittigde de directeur , die op zijn beurt bij mij terecht kwam ."
therapeut/noun/LN_20051202_01/60556	b	-1.44297947862	2.81690683101	1.64126696156	1.50474133293	-0.318640640911	1.82409154719	-2.04779877502	-1.03828599195	-1.35239475409	4.91651006206	1.89851390325	2.48909810965	"Zou het niet nuttig zijn eens navraag te doen bij de nu al overvraagde kinderpsychiaters en <font color=""red"">therapeuten</font> welke invloed het opgelegde ritme gaat hebben op termijn ?"
therapeut/noun/LN_20010315_01/4222	b	-0.998065955116	-0.798870659342	-0.47407468981	0.433408288598	-1.48973735173	0.118637131731	1.67413146167	1.81626801837	-1.11021299286	-3.11586060118	0.202586412614	-2.01214310154	"Eén Belg op vier raadpleegt tijdens zijn leven ten minste één keer een arts , psycholoog of <font color=""red"">therapeut</font> omdat hij of zij een psychisch probleem heeft ."
therapeut/noun/volkskrant20041005/2742	b	2.363809778	1.99247548975	1.64377698093	0.522418752296	2.94128184827	-0.856837925894	-0.834266917368	1.09804418044	-0.396757088672	1.54094271855	0.688003488234	1.5816107185	"Een <font color=""red"">therapeut</font> : ' Bij de pedofielen moet je uitkijken dat het niet te gezellig wordt ."
