token	label	LeNC44.L1LLRx5.x	LeNC44.L1LLRx5.y	LeNC77.L1LLR.x	LeNC77.L1LLR.y	LeNC44.L1LLR.x	LeNC44.L1LLR.y	LeNC77.L1LLRx5.x	LeNC77.L1LLRx5.y	LeNC44.ppmi.x	LeNC44.ppmi.y	LeNC77.ppmi.x	LeNC77.ppmi.y	text
therapeut/noun/DM_20051207_01/68382	b	3.05341521484	-0.227526926161	1.51662320183	-0.92395183797	2.80687774498	1.58488963222	0.767621820578	-2.12039169374	1.09558750255	2.42668173339	-0.199878775047	1.61396774906	"Sinds zijn bezoek aan de <font color=""red"">therapeut</font> heeft Savage strakke afspraken met zijn man over avonturen buiten de deur ."
therapeut/noun/DS_19990923_01/67442	b	1.10780541037	-0.685135531006	0.644037478479	-0.190689274237	1.27930789261	1.26467552044	0.942145653207	-1.12524176653	1.48843890117	1.19738502765	-0.0241716204231	0.878988220424	"Hij spreekt uit ervaring , als <font color=""red"">therapeut</font> in een Britse instelling die intussen zijn deuren sloot : "" Eindeloze discussies hebben we daar gevoerd met de gebruikers ."
therapeut/noun/DS_19991113_01/63828	b	9.40935485805	0.457140778519	5.76691498168	-1.2179657844	7.46358002249	4.04786975555	-5.57303771044	-6.31945426329	-1.75228135547	7.31889054406	0.408960376037	6.00121094781	"INTERVIEWRwandese <font color=""red"">therapeut</font> begint hulpgroep voor slachtoffertjes genocide"
therapeut/noun/DS_20000212_01/44458	b	1.5571921996	0.83645431258	0.907092415771	0.164946842867	1.65424286441	0.390796947967	0.374275926274	1.0002706551	0.0770711734842	0.740029218999	0.60769985078	0.902438204577	"Dat is een veronderstelling die veel mensen maken omdat wij allebei <font color=""red"">therapeut</font> zijn ."
therapeut/noun/DS_20000408_01/67143	b	5.64933738833	3.05451536895	-2.36165946506	-3.34834090533	-3.38275034404	-1.98690613469	6.71572478763	-3.92158906149	4.21033657353	-2.40592022607	4.14423349074	-2.31412783022	"De meeste details komen de <font color=""red"">therapeuten</font> toch te weten in de loop van de begeleiding ."
therapeut/noun/DS_20000607_01/63797	b	1.34888192766	0.458440002931	0.86630883539	0.403091909199	1.50791468976	0.662393365377	0.30386313911	0.145906344604	1.0375934145	0.999108301656	0.681500576977	0.747983210032	"Ze bespreken dat probleem met twee verschillende <font color=""red"">therapeuten</font> ."
therapeut/noun/DS_20000615_01/16611	b	-8.80835276551	-5.20691889953	-3.54493890317	1.1520062919	-8.88966083577	2.88884517152	6.85942537343	1.97794656793	-3.77842983734	-7.2734829737	-0.351686463897	-3.35375699156	"Maar nuttige hulpverleners , zoals <font color=""red"">therapeuten</font> , psychologen en verpleegkundigen , moeten werken in onmogelijke omstandigheden ."
therapeut/noun/DS_20000810_01/50703	b	-0.466043622517	-3.87874603116	-2.68162603029	-0.769893298291	-2.45574740611	1.63127158715	6.22134518004	-1.01133525708	2.39905576509	-2.11596072445	-1.62043125597	-2.20642071264	"De zes <font color=""red"">therapeuten</font> die voor Welzijnswerk in Vlaanderen seksuele delinkwenten begeleiden , noemen de publicatie van Nicolas ' crimineel ' ."
therapeut/noun/DS_20001130_01/26674	b	2.80691835574	-1.1044476128	1.80910447685	-1.25033913524	3.20141711979	1.43215707021	1.5084360982	1.91758450449	3.471783973	-1.24578507082	-2.92280401528	0.275005609224	"Bovendien is zo'n leerkracht niet geschoold als <font color=""red"">therapeut</font> ."
therapeut/noun/DS_20010209_01/54284	b	2.72569964804	8.43673280504	3.54155783659	4.65537980583	2.68401141839	-7.72017802367	-7.39081224876	2.31819852705	-7.80829613188	6.96547744792	5.12378976219	6.24873673683	"Met andere woorden : niet de klant moet zich aanpassen aan de <font color=""red"">therapeut</font> , wel omgekeerd !"
therapeut/noun/DS_20010727_01/31754	b	0.928959901152	1.2678410855	0.75167467589	0.400814321681	1.12172506096	-0.0137243354527	0.334718655874	0.620276309075	0.165149109658	1.10593087136	0.3708872673	-0.171873661404	"Normaal gesproken had zij naar een <font color=""red"">therapeut</font> moeten of kunnen doorverwijzen . """
therapeut/noun/DS_20011207_01/21766	b	4.31575945605	0.133414698535	1.81136497606	-1.81419533359	4.35581979472	1.59401991721	2.04807181841	1.82472835224	0.0432644237976	3.25320197679	0.793984799292	2.90730235218	"Daar staat de <font color=""red"">therapeut</font> in de telefoonklapper van een gemiddeld gezin alfabetisch gerangschikt tussen de advocaat en de verzekeringsmakelaar ."
therapeut/noun/DS_20020404_01/79883	b	2.43738156379	-2.61175791789	0.384385382948	-2.2410319022	2.21025976055	3.5884828873	4.52182076911	-0.27014188416	3.01469891907	-0.873097014787	2.6365469026	-0.632731276378	"Een op de drie zoekt toch professionele hulp bij een <font color=""red"">therapeut</font> ."
therapeut/noun/DS_20031115_01/133815	b	-0.474822421571	4.41133814574	2.10133644119	2.26559741508	0.460703733603	-3.59140546873	-3.29425785932	-0.329028463552	-1.30816154923	1.45279401391	-0.220535323939	1.82804482495	"Aan zijn <font color=""red"">therapeut</font> vertelde A. dat hij zelf begin jaren negentig misbruikt werd door zijn buurman , Marcel Vervloesem , een goede vriend van zijn ouders ."
therapeut/noun/DS_20040417_01/8534	b	0.824380017209	-4.55295762911	3.71010522545	-1.00733539653	-2.77225886894	-2.75795771829	-1.78792150241	6.03689683629	-3.16697463301	1.38048373442	-2.10617473577	1.84318398215	""" Mensen moeten opnieuw leren elkaar te helpen , in plaats van meteen naar de <font color=""red"">therapeut</font> te lopen "" , zegt Bob Vansant , de Steve Stevaert van de psychotherapie . door gilbert roox , foto XXX"
therapeut/noun/DS_20040817_01/59342	b	-2.46920990059	-4.26373050394	-3.45987735297	-0.128136690752	-3.57933852524	2.86931802545	7.34542317641	2.28847786878	-2.28329618331	-7.18108159295	-1.68267281335	-5.53393240713	"Er is bovendien dringend nood aan een centrum waar psychiaters , psychologen , <font color=""red"">therapeuten</font> en maatschappelijk werkers de verdachte een aantal weken kunnen observeren alvorens een advies over zijn internering te geven . """
therapeut/noun/DM_20050415_01/60579	b	-5.26278262932	-2.3318616579	-3.30677207003	2.76820152662	-5.60244115641	1.84431766119	7.27911895735	1.57709611133	-4.1518705008	-4.75968328836	-0.380872524942	-4.41269049879	"Daarin komen mensen aan het woord die beroepshalve veel met woede in aanraking komen , zoals politieagenten , psychologen en <font color=""red"">therapeuten</font> ."
therapeut/noun/DM_20050218_01/5970	b	2.0754460353	-0.240090894226	0.802451306459	-0.245424204892	2.09249334247	1.15324091602	1.00328398796	0.42332002345	0.698114001384	0.972077476828	0.5810268342	1.04421883198	"In de jaren daarna ' versleet ' Marian menig <font color=""red"">therapeut</font> ."
therapeut/noun/DM_20041208_01/50185	b	2.18150368938	1.60439675854	1.43990977004	0.573267467864	2.06867834844	-0.0628516812949	-0.786094364482	0.651790053443	-0.142335896291	1.85473416879	0.113509973108	2.43523987301	" <font color=""red"">Therapeuten</font> waarschuwen dat de gevolgen van een liefdesverslaving soms fataal kunnen zijn ."
therapeut/noun/DM_20031220_01/88942	b	-0.512929337747	3.37097604403	1.74976237907	1.72793617463	0.631328477088	-2.51249922819	-2.15090752753	-0.519667940194	-0.494207237754	1.79914419861	0.8593744198	1.52910224855	"Iedereen loopt naar <font color=""red"">therapeuten</font> om daar het centrum van de belangstelling te kunnen zijn ."
therapeut/noun/BL_20010530_01/28607	b	-3.520284258	0.243564995311	-2.07917013239	-1.97853876924	-3.35298860023	-0.803406086071	3.89284072476	4.52453363712	-0.356635775588	-2.79625906643	3.3664539424	-3.73133460343	"Zo zijn er feiten geweest van <font color=""red"">therapeuten</font> die hun patiënten onder hypnose verdoofden ."
therapeut/noun/BL_20021223_01/84265	b	2.46994641634	1.7460309014	1.44628339674	0.747206058428	2.28876968514	-0.0486885803654	-1.01099982756	0.290962500056	-0.644059328188	0.395601763883	-0.361693398669	0.942625408946	"Ze hebben beiden bij een <font color=""red"">therapeut</font> een cursus Ik rouw van jou gevolgd , waarin kinderen met een groot verlies leren omgaan ."
therapeut/noun/BL_20031108_01/2414	b	1.03577186395	5.34330617771	1.71390069091	2.06307270747	0.423414084632	-3.95115939549	-2.16092829143	1.56910310958	-1.19280618522	1.22172342571	0.560227811598	1.19581018758	""" Die mannen zijn zo geraffineerd dat ze iedereen , zelfs <font color=""red"">therapeuten</font> , kunnen misleiden in het dubbele leven dat zij leiden ."
therapeut/noun/BL_20031121_01/38959	b	0.651913134712	0.0355760003394	0.495846291861	0.513425198032	0.714898563989	0.956956444797	0.66483809697	0.664303524789	1.62146659333	-0.528831940458	0.24284833612	-0.199016907996	"Moeder Arvizo merkte dat haar zoon zich niet goed voelde en stuurde hem uiteindelijk naar een <font color=""red"">therapeut</font> voor psychologische begeleiding ."
therapeut/noun/BL_20040713_01/40626	b	3.81529359663	-8.57048745889	4.57226469776	-2.67136833629	3.70048551235	8.2572709482	-2.83726798178	-7.19355278898	5.00825892837	4.54042747391	2.54875929406	4.80706592463	"Uit de tekeningen kwamen veel diepgaande gesprekken voort , "" vertelt creatief <font color=""red"">therapeut</font> Jan Vandromme ."
therapeut/noun/BL_20050302_01/34137	b	2.43925369875	0.453788124774	1.16545598464	0.0888291552273	3.01319038647	1.56047637614	0.160002893052	0.000187361713047	0.531232179834	2.14300900526	0.491694836302	0.933514197315	"Hij moet nog contact houden met een <font color=""red"">therapeut</font> , maar wordt verondersteld om opnieuw deel te nemen aan de samenleving ."
therapeut/noun/DM_19990326_01/64737	b	-2.00492446908	4.50256846578	0.530616066751	3.40912114041	-1.23665869643	-3.59151856285	-1.84529162866	4.68786099006	-3.58477787238	-6.83195113215	-1.77629807289	-4.46151465781	""" Dan hebben we de garantie dat de <font color=""red"">therapeut</font> zich niet laat inpakken door de stalker . """
therapeut/noun/DM_19990619_01/63748	b	2.77904494759	5.13297492582	3.21450714382	2.25142124581	3.3344871586	-3.31749266691	-4.10287381395	1.8687298028	-1.01587316935	2.81314799532	0.461333250587	3.24936644168	""" ( lacht ) Voor alle duidelijkheid : ik ben geen <font color=""red"">therapeut</font> , hé ."
therapeut/noun/DM_19990916_01/49912	b	-0.715625148705	7.48285416085	4.30733456216	0.454936059908	-3.02985879153	-5.96505884298	-0.5995304897	6.32614923183	-1.5698682202	-12.0197865929	-2.7805482832	-3.69926839428	"Heel laat beseft de intelligente Francine dat ook <font color=""red"">therapeuten</font> ziek kunnen zijn ."
therapeut/noun/DS_20041007_01/12944	b	1.08033882132	7.95333621812	4.02031073065	4.3684405393	0.753527401509	-6.91927023926	-7.25913572731	3.6378392062	-3.39711255403	3.4559550595	0.566647761211	4.28731243903	"En "" het stigma van neuroses "" dat volgens Chaims <font color=""red"">therapeut</font> het gevolg zou zijn van de oorlog , doet Hannah af met : "" Woody Allen was toch ook geen oorlogsslachtoffer . """
therapeut/noun/DM_19991217_01/39128	b	2.80164955031	2.51245569613	2.57277223761	0.0412815646411	2.82050904589	-0.705565500361	-1.61689011625	2.72152908367	-1.343840156	3.7247150756	1.73797598798	3.4693649865	""" Zeker niet ondoordacht "" , stelt de <font color=""red"">therapeut</font> ."
therapeut/noun/DM_20000722_01/29813	b	-0.96809928721	4.165407682	1.65438320888	2.95313339471	0.122454120657	-3.1142357442	-3.94248567029	-1.27536510138	-1.7093824533	1.01916092527	-1.71517174579	1.52111745714	"De <font color=""red"">therapeut</font> vertelde me dat mijn vader gemengde kinderen had gewild om zichzelf te bewijzen tegenover zijn moeder ."
therapeut/noun/DM_20000913_01/25301	b	-1.07507122088	2.99807393596	1.0432264262	2.05305969882	-0.655219021918	-2.00932064589	-1.708280716	2.05712926542	-1.84230403933	-2.22844895146	-1.1113063763	-1.44333575587	"Zoals alle vaders hoeft de therapeut daar zelfs niet veel voor te doen : veel <font color=""red"">therapeuten</font> hebben van hun eigen vader de kracht geleerd van het betekenisvolle zwijgen en de Franse psychoanalyticus Lacan ontwikkelde zelfs het revolutionaire idee van de korte sessie , die net zo goed de gebruikelijke vijftig als vijftien of vijf minuten kon duren ."
therapeut/noun/DM_20001012_01/14925	b	-2.53511359514	-1.55098718679	-1.41618343356	0.828472704883	-0.451164634798	4.01634051533	3.28174875175	-2.70032999136	1.08779680805	3.31256077818	1.44814696323	-0.427148914632	"De verhouding mannelijke en vrouwelijke gebruikers leiden de onderzoekers af uit gegevens van <font color=""red"">therapeuten</font> ."
therapeut/noun/DM_20001122_01/20658	b	0.092586017717	4.56545111353	1.88113237507	2.34652774581	0.685970134729	-3.499710438	-2.95792335848	0.436475148602	-6.01835713102	2.27844541226	5.77946583582	4.52717516377	"De <font color=""red"">therapeut</font> had geconstateerd dat hun relatieprobleem het gevolg was van cultuurverschillen ."
therapeut/noun/DM_20010331_01/111131	b	2.30492015074	-0.152352989426	0.879022561346	-1.17461642759	2.33404654392	1.34839135746	1.69029857962	0.404949343929	0.347188767981	1.52740092546	1.28834483058	1.32789678452	"Maar waarin biedt de life style coach dan een alternatief voor de <font color=""red"">therapeut</font> , die toch al veel langer op dat terrein actief is ?"
therapeut/noun/DM_20010331_01/111372	b	2.98871470047	2.66305731194	2.09430698105	0.42014190862	3.10823152178	-1.14140320872	-1.48999275787	1.666150601	-0.868551677142	2.46322177166	0.968084758241	2.1000566262	"Als je bij een <font color=""red"">therapeut</font> gaat , moet je eigenlijk al a priori aanvaarden dat je ' ziek ' bent , dat er een disfunctionaliteit zit in je eigen persoon , die alleen maar met hulp van buitenaf kan worden ' genezen ' ."
therapeut/noun/DM_20020902_01/49524	b	-0.12109908661	0.334103600973	0.327552452493	1.05506187562	0.360792834184	1.3372040739	-0.328012763662	-0.831068163165	0.291470395244	0.876858221084	-0.174692005201	0.641400079798	"De gesprekken met zijn moeder en zijn <font color=""red"">therapeut</font> lijken hem te helpen om de gebeurtenissen van het voorbije jaar anders dan als een nachtmerrie te zien ."
therapeut/noun/DM_20031122_01/113327	b	-8.14419234091	-1.69930079491	-6.10888673087	4.08543455666	-9.50735536747	-2.42518415673	5.23123363928	9.06805768669	-1.66220103928	-10.053976104	-1.83096216304	-7.75779353602	"De Britse psychoseksuele <font color=""red"">therapeut</font> Denise Knowles legt de schuld daarvoor deels bij de overheid ."
therapeut/noun/DM_20031122_01/58919	b	-0.949741614625	6.04814921517	2.44866010416	0.915582716357	2.23980254009	-5.17941004713	-2.11464767479	-0.626912862721	-3.65391751906	3.97429841482	-0.634867272219	2.87730409529	"Het verhaal komt bij de politie terecht : in Amerika hebben <font color=""red"">therapeuten</font> het recht pedofiliezaken aan te geven als er gegronde verdenkingen tegen iemand zijn ."
therapeut/noun/DM_20000526_01/57315	b	2.01791081174	1.98831873633	1.49338984513	0.511820793216	2.27997805938	-0.566782581481	-0.585540948725	0.495859650689	-1.18782660952	3.45159290799	0.56145942333	2.20522530708	"In Amerika is het modieus om naar een <font color=""red"">therapeut</font> te stappen "" , zegt Weidner ."
therapeut/noun/nrc20000615/77373	b	-0.287493896249	-1.71361558157	-0.612512703882	1.62699349713	1.12402824005	2.90150547183	0.785146040025	3.71050411561	-0.00564140798405	0.838448121196	0.000598530050633	0.797202672523	"Sinds kort staat er op de lijst met zestig <font color=""red"">therapeuten</font> ook één behandelaar die zich speciaal richt op mensen met een tunnelfobie ."
therapeut/noun/DS_20050822_01/44215	b	3.13057460622	1.76443624533	2.04847874001	-0.393664381552	3.55474566516	-0.207620584902	-0.524217156804	2.16412564688	5.09837848575	-1.07295943388	2.94127342755	2.21847459886	"Kan iemand de magere bebrilde percussionist alsjeblieft een goede <font color=""red"">therapeut</font> aanraden ?"
therapeut/noun/DS_20051003_01/34737	b	1.13453848139	1.56492442323	1.04365718008	0.605304528679	1.15905545216	-0.366338640169	-0.324978852568	0.836206960896	-0.0268309044219	1.60896983604	0.476530767012	1.40254002613	"Schouten zegt dat een - goede - <font color=""red"">therapeut</font> nooit zal adviseren om wel of niet uit elkaar te gaan ."
therapeut/noun/NB_20010201_01/49442	b	4.30285700461	0.36696245588	1.52445256159	-1.25831172523	4.22168781031	1.75798296096	1.29945520942	-0.105040680276	0.144275955719	5.20621791478	-0.748754055614	3.58025199559	"Zo één tijdschrift lijkt meer op te lossen dan een hoop <font color=""red"">therapeuten</font> bij elkaar ."
therapeut/noun/NB_20010206_01/127229	b	0.901408343542	1.007591523	0.679595697698	0.161386031956	1.02463921622	0.386195001964	0.557856805638	0.32470430139	0.408856005899	1.87291887987	0.72870738525	1.26043847334	"Een roddelblad wist te vertellen dat Kidman en Cruise om deze scène te spelen een <font color=""red"">therapeut</font> nodig hadden ."
therapeut/noun/NB_20010602_01/123613	b	3.89896289158	0.649262502502	1.72152449296	-0.716796278935	3.28115047229	1.13958263545	1.2492870916	1.50479532904	0.590365617353	2.0445468424	-0.519027711972	1.78427690266	"Eén uur per week met een <font color=""red"">therapeut</font> praten heeft voor die jongeren geen effect ."
therapeut/noun/NB_20011129_01/60685	b	2.38938626846	0.071922578565	1.30136212367	-0.0843163285348	2.6074045704	1.6644169748	-0.00721280211783	-1.02879512275	0.773931311555	2.23359246201	0.367156366778	1.43198327649	"Hij moet zich om de drie maanden met een attest van zijn <font color=""red"">therapeut</font> aanmelden bij het gerecht ."
therapeut/noun/NB_20021010_01/70059	b	-0.321647004415	-6.6126149548	-4.46391163347	-0.128177797029	-4.90645565128	3.3127401737	8.88668966918	0.597246145594	3.84326737122	-3.74870173202	2.02069727667	-4.46928365028	"Van de elf <font color=""red"">therapeuten</font> die in het Leerproject Daders Seksueel Geweld werken , moeten drie deeltijdse krachten weg ."
therapeut/noun/NB_20030303_01/129192	b	1.68714781578	1.36516800333	1.60188544154	0.619055956429	2.04495732264	0.362719581531	-1.00382301653	0.909963431307	0.251318913241	1.64487690547	0.581088815821	1.76975933023	"Met een <font color=""red"">therapeut</font> kan je niet trouwen ."
therapeut/noun/NB_20031121_01/68097	b	3.3848086647	1.32430633608	1.57279713246	-0.844120869815	3.63437904513	0.593539824717	1.00925574248	0.63534011597	0.119136711501	2.41546165393	1.61286956727	1.7932478518	"SINT-NIKLAASTwee maanden wachten alvorens je bij een <font color=""red"">therapeut</font> terecht kan , het is geen uitzondering ."
therapeut/noun/NB_20050330_01/55896	b	0.868330257414	-0.622989532385	0.106472549247	0.020978535031	1.09363231394	1.50969224039	1.40122183417	0.0819908742809	0.856032018923	0.440193434245	0.445679243606	0.358631652833	"De rockende wildebras Kelly Osbourne heeft dankzij papa- en mamalief een <font color=""red"">therapeut</font> gevonden die haar zal helpen om te stoppen met drinken ."
therapeut/noun/volkskrant20040211/25536	b	1.40986032215	4.51711433222	2.6325756244	2.56124964958	1.42789004419	-3.45436892149	-3.44643072117	2.32122816673	-1.17730980576	1.55134197925	1.11356698389	1.60859989748	"In een crisissituatie blijken de meeste betrokkenen geen behoefte te hebben aan <font color=""red"">therapeuten</font> ."
therapeut/noun/ad20010330/22186	b	2.71957130317	-2.033014504	0.252846471203	-1.53509142308	2.42695572199	2.95283987706	3.99567495416	-1.07824987825	2.21305620345	1.38904516003	-1.99694642596	-1.30495250271	"Bij de standaardbehandeling stelt de <font color=""red"">therapeut</font> een cliënt steeds iets verder of langer bloot aan het object van zijn angst : hoogten of diepten ."
therapeut/noun/ad20010508/15768	b	3.80556166219	-0.545502689263	1.58975104848	-1.92738577954	3.61026518356	1.11947660075	3.4793085834	-0.808412622553	2.78422550744	3.34897559145	-2.91332563103	2.50962878888	"Het huidige kabinet heeft recent aangetoond , dat het met het inpakken van zijn gevoelens in een dikke laag beton , nu echt toe is aan een goede <font color=""red"">therapeut</font> ."
therapeut/noun/ad20020402/24549	b	2.36086663575	1.51161480802	1.82480857911	-0.00923480972669	2.64925399179	0.0900147744384	-0.746186998708	0.107867827167	-0.220884092696	1.64428410052	0.294839233716	1.94015688855	"Als de Israëlische premier Sharon bij een <font color=""red"">therapeut</font> op de bank zou liggen , had die hem zeker geconfronteerd met de herhalingsneurose van Beiroet : een psycho-politiek syndroom dat niet voorkomt in het handboek van psychiaters , maar wel in dat van Sharon ."
therapeut/noun/ad20020621/3298	b	2.7769818815	-0.757282601853	1.20730594038	-1.84401557724	2.97644648661	1.70180963798	3.80135797511	-0.743125804729	-1.19042719162	-0.995201937561	2.81949492947	-0.348073678179	"Nederland 3 - Onlangs is voor het eerst een <font color=""red"">therapeut</font> veroordeeld tot het betalen van smartengeld aan de ouders van een ` incestslachtoffer ' ."
therapeut/noun/ad20030514/35186	b	0.311922997853	4.27003778904	2.13379939934	2.17109557064	0.207409679592	-3.28211206748	-2.96157057938	0.793949309978	2.74876311733	0.350331056139	-0.614947116396	0.809385790089	"De <font color=""red"">therapeut</font> had geen idee voor welke taak hij was geroepen ."
therapeut/noun/ad20031220/46115	b	3.37097124526	-0.366108789715	1.66994712278	-0.800341993996	2.92685761063	2.38603951489	0.844768014772	-1.16184967758	2.34498060649	2.67790407239	-0.179783311313	2.08758900451	"Maar het beeld van de presentator als een moderne <font color=""red"">therapeut</font> strookt totaal niet met de werkelijkheid , vindt Ten Brink , die jarenlang à la Het Spijt Me vanuit de ` liefdescaravan ' met een videoband en een bos bloemen langs de deuren van gedesillusioneerd Nederland trok : "" Ik ben geen deskundige , ik maak gewoon een amusementsprogramma . """
therapeut/noun/ad20040213/42032	b	-0.536207539816	0.480026893678	0.0987270958547	0.909463829959	-0.439947136866	0.813516786712	0.258278964354	-0.457602259399	0.907994163916	1.24762594891	0.212440064541	0.939848438604	"De <font color=""red"">therapeuten</font> waren ooit zelf verslaafd en weten dus als geen ander hoe het is om aan een verslaving te lijden ."
therapeut/noun/nrc19990417/22631	b	2.63067798315	3.05825135999	2.53065782857	0.45357448653	2.71719235249	-1.09121485495	-2.29050986884	1.45934243429	-1.83047788256	4.0290570021	0.531559022136	3.79029845601	"Ontstaan bij een <font color=""red"">therapeut</font> toch warme gevoelens , dan is dat volgens Van Marle goed te herkennen ."
therapeut/noun/nrc19990717/86460	b	-1.30201079775	0.551819188778	-0.113439339554	1.40577770148	-1.58608511081	-0.175059209864	0.279861494903	2.11897573928	-0.0817122400148	-1.55027550668	0.700138857913	-0.834383477667	"Toch durf ik vol te houden dat de specifieke relatie tussen de <font color=""red"">therapeut</font> en de patiënt de factor is die de doorslag geeft in het welslagen van een therapie ."
therapeut/noun/nrc19991020/3873	b	1.1884750086	-1.98294261959	-0.86585344842	-0.801956105451	0.626181252919	2.08458161658	4.25348057353	1.01288990894	0.34315202181	-2.23143983612	0.962446138708	-1.66916526605	"In april dit jaar stelde de rijksrecherche een strafrechtelijk onderzoek in naar vier <font color=""red"">therapeuten</font> die werden verdacht van seksuele contacten met patiënten ."
therapeut/noun/NB_20001021_01/341353	b	-0.165580059955	2.65368274805	1.12088652745	1.59683238215	0.261990355901	-1.27926554861	-1.69706507354	0.523549092913	-0.773307927212	2.17607026827	0.195164889022	1.92757887791	"De <font color=""red"">therapeut</font> was de eerste die me liet inzien dat mijn kwalen terug te voeren waren op die bewuste nacht ."
therapeut/noun/NB_20000624_01/85197	b	-1.25847978398	1.50342997572	0.0100184479292	1.2145842929	-0.624458627826	-0.749462686402	0.0533299382564	-2.20397138485	-0.834509646164	1.62716261777	-1.51092587554	0.38602956107	"De <font color=""red"">therapeut</font> tekende verzet aan en eiste tijdens zijn nieuw proces dat het T-shirt van het verkrachtte meisje zou worden onderzocht ."
therapeut/noun/NB_20000113_01/177181	b	2.58603688831	2.33961717124	1.93944147747	0.771572465439	2.88148792632	-0.408458905242	-1.60483681794	1.41398879831	-0.406879742045	2.45126535647	0.490040332739	2.31210847066	"Misschien gaan we wel naar een <font color=""red"">therapeut</font> om er eens over te praten ."
therapeut/noun/NB_19991209_01/143350	b	0.473200106751	-0.289267507299	0.521156493288	-0.0166716382785	0.980653313261	1.32909937071	0.687174638233	-0.575094538427	0.638311858267	1.01416676299	0.27338227389	0.922732553955	"Mensen bespreken hun problemen liever met een vriend of met een <font color=""red"">therapeut</font> ."
therapeut/noun/DT_20000617_01/567	b	1.88436107674	0.193230595555	1.28040971218	-0.341461242067	1.67212642026	1.6902460189	0.295795581214	0.491732383835	1.15055439279	3.98445138648	0.457537300886	3.0493620793	"Is dit boek daarom een boek van en voor <font color=""red"">therapeuten</font> ?"
therapeut/noun/DT_20010908_01/8752	b	-0.458499819516	6.22044637108	4.36323136191	3.28519618947	3.43489978898	-4.40683593744	-6.97444581982	0.32980582911	-2.65958732878	5.6527334792	-0.839658566672	5.06334766788	"En wat dat betreft ben ik aan de verliezende hand , want het aantal <font color=""red"">therapeuten</font> dat onzin uitkraamt is aanmerkelijk groter dan mijn medestanders ."
therapeut/noun/DT_20010908_01/9967	b	3.1662498403	1.61987248913	1.83867554311	-0.196021356109	3.4634724266	0.112588164138	-1.17069699831	-0.476409019821	-2.60452137017	4.97933113755	1.11789893206	3.89345965361	"De <font color=""red"">therapeut</font> denkt precies het tegenovergestelde ."
therapeut/noun/DT_20020302_01/44170	b	1.55203642028	1.54226388533	1.31369357708	0.428324935645	1.8890000036	-0.0159431244983	-0.369219773359	0.901394568824	0.0431810826844	2.27967423569	0.575325096836	1.85129193026	"Je bent eigenlijk ook een beetje <font color=""red"">therapeut</font> ."
